{
  "organization_id": 1,
  "project_id": 42,
  "key_id": 123,
  "event_id": "cbf6960622e14a45abc1f03b2055b186",
  "received": 1759215783.850951,
  "retention_days": 90,
  "downsampled_retention_days": 90,
  "accepted_outcome_emitted": false,
  "attributes": {
    "sentry.category": {
      "type": "string",
      "value": "http"
    },
    "sentry.description": {
      "type": "string",
      "value": "GET /api/0/organizations/?member=1"
    },
    "sentry.group": {
      "type": "string",
      "value": "37e3d9fab1ae9162"
    },
    "sentry.is_segment": {
      "type": "boolean",
      "value": false
    },
    "sentry.name": {
      "type": "string",
      "value": "http"
    },
    "sentry.normalized_description": {
      "type": "string",
      "value": "GET *"
    },
    "sentry.op": {
      "type": "string",
      "value": "http"
    },
    "sentry.origin": {
      "type": "string",
      "value": "manual"
    },
    "sentry.platform": {
      "type": "string",
      "value": "other"
    },
    "sentry.sdk.name": {
      "type": "string",
      "value": "raven-node"
    },
    "sentry.sdk.version": {
      "type": "string",
      "value": "2.6.3"
    },
    "sentry.segment.id": {
      "type": "string",
      "value": "968cff94913ebb07"
    },
    "sentry.status": {
      "type": "string",
      "value": "ok"
    },
    "sentry.trace.status": {
      "type": "string",
      "value": "ok"
    },
    "sentry.transaction": {
      "type": "string",
      "value": "hi"
    },
    "sentry.transaction.op": {
      "type": "string",
      "value": "hi"
    },
    "foo": null
  },
  "end_timestamp": 1759215782.849409,
  "is_segment": false,
  "links": [
    {
      "trace_id": "0f62a8b040f340bda5d830223def1d82",
      "span_id": "cbbbbbbbbbbbbbbc",
      "sampled": true,
      "attributes": {
        "span_key": {
          "type": "string",
          "value": "span_value"
        }
      }
    },
    {
      "trace_id": "0f62a8b040f340bda5d830223def1d82",
      "span_id": "cbbbbbbbbbbbbbbd",
      "sampled": null,
      "attributes": {
        "span_key": null
      }
    },
    {
      "trace_id": "0f62a8b040f340bda5d830223def1d82",
      "span_id": "cbbbbbbbbbbbbbbe",
      "attributes": null
    }
  ],
  "name": "http",
  "parent_span_id": "968cff94913ebb07",
  "span_id": "bbbbbbbbbbbbbbbb",
  "start_timestamp": 1759215782.349409,
  "status": "ok",
  "trace_id": "ff62a8b040f340bda5d830223def1d81"
}
