{
  "organization_id": 1,
  "project_id": 42,
  "key_id": 123,
  "event_id": "cbf6960622e14a45abc1f03b2055b186",
  "received": 1759215783.850951,
  "retention_days": 90,
  "downsampled_retention_days": 90,
  "attributes": null,
  "end_timestamp": 1759215782.849409,
  "is_segment": null,
  "accepted_outcome_emitted": null,
  "links": null,
  "name": null,
  "parent_span_id": null,
  "span_id": "bbbbbbbbbbbbbbbb",
  "start_timestamp": 1759215782.349409,
  "status": "ok",
  "trace_id": "ff62a8b040f340bda5d830223def1d81"
}
